{
  "version": "1.0",
  "thresholds": {
    "VAGUENESS_THRESHOLD": 0.6,
    "EMOTION_THRESHOLD": 0.6,
    "CONTRADICTION_THRESHOLD": 0.6,
    "DISTRESS_HARD_STOP_THRESHOLD": 0.85
  },
  "priority_order": [
    "SAFETY_FALLBACK",
    "LOGIC_CLARIFY",
    "EMPATHY_EXPAND",
    "PRECISION_NARROW",
    "EMPATHY_BASE"
  ],
  "routes": {
    "SAFETY_FALLBACK": {
      "persona_used": "SAFETY_FALLBACK",
      "state_machine": null,
      "max_steps": 0,
      "allowed_depth_range": [
        0,
        3
      ],
      "fallback_route": "EMPATHY_BASE"
    },
    "LOGIC_CLARIFY": {
      "persona_used": "LOGIC_CLARIFY",
      "state_machine": "inconsistency_resolution",
      "max_steps": 1,
      "allowed_depth_range": [
        0,
        2
      ],
      "fallback_route": "EMPATHY_BASE"
    },
    "EMPATHY_EXPAND": {
      "persona_used": "EMPATHY_EXPAND",
      "state_machine": "emotional_expansion",
      "max_steps": 2,
      "allowed_depth_range": [
        0,
        3
      ],
      "fallback_route": "EMPATHY_BASE"
    },
    "PRECISION_NARROW": {
      "persona_used": "PRECISION_NARROW",
      "state_machine": "precision_narrowing",
      "max_steps": 2,
      "allowed_depth_range": [
        0,
        2
      ],
      "fallback_route": "EMPATHY_BASE"
    },
    "EMPATHY_BASE": {
      "persona_used": "EMPATHY_BASE",
      "state_machine": null,
      "max_steps": 0,
      "allowed_depth_range": [
        0,
        3
      ],
      "fallback_route": "EMPATHY_BASE"
    }
  }
}